{
  "atlas_id": "reference-atlas-core",
  "atlas_release": "v1.0.0",
  "authority_lock_digest": "sha256:f35634bf23db21fae2249262aaf8692ea0e5050fbe50a9287874f7772bfb8657",
  "commit": "74e339075459d3606b5899ad886034155ee9f995",
  "core_policy_version": "1.0.0",
  "coverage_epoch": "2026-08-28",
  "evidence_set_digest": "sha256:b5158c3024895384be19a0d582d532909126491cff19d28c2b6ae45744942894",
  "graph_digest": "sha256:fcb9db151f1e863a1a5f1cc5ede5fd049d442ffa4cf40534e386a6eb80c32aac",
  "issued_at": "2026-08-28T11:50:48Z",
  "provenance_digest": "sha256:25f4b96a46ae72f2c79f7290769f0465fecb9d4b29af11b73185cd2fe23c2f40",
  "required_profiles": [
    {
      "evidence_ids": [
        "core.audit",
        "core.compatibility",
        "core.contracts",
        "core.skill",
        "core.tooling"
      ],
      "profile": "local",
      "result": "pass"
    }
  ],
  "sbom_digest": "sha256:e96103992b62754e01b068dfc2200be3c808acb9c8c6e28bff7db6e66dfddb2d",
  "schema_version": 1,
  "signature": {
    "digest": "sha256:cd4c0167a58ab5e1413cbfa8e624e6ece6daa332322a08144a927b9d6fab551e",
    "type": "payload-sha256"
  },
  "skill_eval": {
    "digest": "sha256:2f9a6d516e77015439f7db1fefccba1fe736cabe434371948b8d125e9512abfc",
    "pass_rate": 1
  },
  "skill_package_digest": "sha256:3b91a7177910f3a7e3ecfc0c6aaabe1708a9e726462bbb08f25ae08379a8247a"
}
